[{"site":"lima","pollutant":"NOx","unit":"ug/m3","provenance":"assumption","available":true,"grid":{"nx":51,"ny":51,"dx_m":100.0,"dy_m":100.0,"x0_m":-2500.0,"y0_m":-2500.0},"geo_ref":{"crs":"WGS84 (EPSG:4326)","source_lon":-84.122,"source_lat":40.792,"sw_lon":-84.151663,"sw_lat":40.769542,"ne_lon":-84.092337,"ne_lat":40.814458},"periods":[{"averaging_period":"1","values":[0.0,0.0,0.0,0.0,0.0,0.0,0.0,0.0,0.0,0.0,0.0,0.0,0.0,0.0,0.0,0.0,0.0,0.0,0.0,0.0,0.0,0.0,0.0,0.0,0.0,0.0,0.0,0.001,0.001,0.001,0.001,0.001,0.001,0.001,0.0,0.0,0.0,0.0,0.0,0.0,0.0,0.0,0.0,0.0,0.0,0.0,0.0,0.0,0.0,0.0,0.0,0.0,0.0,0.0,0.0,0.0,0.0,0.0,0.0,0.0,0.0,0.0,0.0,0.0,0.0,0.0,0.0,0.0,0.0,0.0,0.001,0.001,0.001,0.001,0.001,0.001,0.001,0.001,0.001,0.001,0.001,0.001,0.001,0.001,0.001,0.001,0.001,0.001,0.001,0.001,0.001,0.001,0.001,0.0,0.0,0.0,0.0,0.0,0.0,0.0,0.0,0.0,0.0,0.0,0.0,0.0,0.0,0.0,0.0,0.0,0.0,0.0,0.0,0.0,0.0,0.0,0.0,0.001,0.001,0.001,0.001,0.001,0.001,0.002,0.002,0.002,0.002,0.003,0.003,0.003,0.003,0.003,0.003,0.003,0.003,0.003,0.003,0.003,0.002,0.002,0.002,0.002,0.001,0.001,0.001,0.001,0.001,0.001,0.0,0.0,0.0,0.0,0.0,0.0,0.0,0.0,0.0,0.0,0.0,0.0,0.0,0.0,0.0,0.0,0.0,0.001,0.001,0.001,0.001,0.002,0.002,0.002,0.003,0.003,0.004,0.005,0.005,0.006,0.006,0.007,0.007,0.007,0.008,0.008,0.008,0.007,0.007,0.007,0.006,0.006,0.005,0.005,0.004,0.003,0.003,0.002,0.002,0.002,0.001,0.001,0.001,0.001,0.0,0.0,0.0,0.0,0.0,0.0,0.0,0.0,0.0,0.0,0.0,0.001,0.001,0.001,0.001,0.002,0.002,0.003,0.004,0.005,0.006,0.007,0.008,0.009,0.01,0.012,0.013,0.014,0.015,0.016,0.016,0.017,0.017,0.017,0.016,0.016,0.015,0.014,0.013,0.012,0.01,0.009,0.008,0.007,0.006,0.005,0.004,0.003,0.002,0.002,0.001,0.001,0.001,0.0,0.0,0.0,0.0,0.0,0.0,0.0,0.001,0.001,0.001,0.002,0.002,0.003,0.004,0.005,0.006,0.008,0.01,0.012,0.014,0.017,0.02,0.022,0.025,0.028,0.03,0.033,0.034,0.036,0.037,0.037,0.037,0.036,0.034,0.033,0.03,0.028,0.025,0.022,0.02,0.017,0.014,0.012,0.01,0.008,0.006,0.005,0.004,0.003,0.002,0.002,0.0,0.0,0.0,0.0,0.0,0.001,0.001,0.001,0.002,0.002,0.003,0.005,0.006,0.008,0.011,0.013,0.017,0.021,0.025,0.03,0.036,0.041,0.047,0.053,0.059,0.064,0.069,0.073,0.075,0.077,0.078,0.077,0.075,0.073,0.069,0.064,0.059,0.053,0.047,0.041,0.036,0.03,0.025,0.021,0.017,0.013,0.011,0.008,0.006,0.005,0.003,0.0,0.0,0.0,0.001,0.001,0.001,0.002,0.003,0.004,0.005,0.007,0.009,0.013,0.017,0.021,0.027,0.034,0.042,0.051,0.062,0.073,0.084,0.096,0.108,0.12,0.13,0.14,0.148,0.154,0.157,0.158,0.157,0.154,0.148,0.14,0.13,0.12,0.108,0.096,0.084,0.073,0.062,0.051,0.042,0.034,0.027,0.021,0.017,0.013,0.009,0.007,0.0,0.0,0.001,0.001,0.002,0.002,0.003,0.005,0.007,0.01,0.014,0.019,0.025,0.033,0.042,0.054,0.067,0.083,0.101,0.121,0.143,0.166,0.189,0.213,0.235,0.257,0.275,0.291,0.302,0.31,0.312,0.31,0.302,0.291,0.275,0.257,0.235,0.213,0.189,0.166,0.143,0.121,0.101,0.083,0.067,0.054,0.042,0.033,0.025,0.019,0.014,0.001,0.001,0.001,0.002,0.003,0.005,0.007,0.01,0.014,0.019,0.026,0.035,0.047,0.062,0.08,0.102,0.129,0.159,0.193,0.231,0.272,0.316,0.361,0.405,0.449,0.489,0.525,0.554,0.576,0.59,0.594,0.59,0.576,0.554,0.525,0.489,0.449,0.405,0.361,0.316,0.272,0.231,0.193,0.159,0.129,0.102,0.08,0.062,0.047,0.035,0.026,0.001,0.002,0.002,0.004,0.006,0.008,0.012,0.018,0.025,0.035,0.048,0.065,0.087,0.115,0.148,0.189,0.237,0.293,0.356,0.426,0.502,0.582,0.665,0.747,0.827,0.901,0.967,1.021,1.062,1.087,1.096,1.087,1.062,1.021,0.967,0.901,0.827,0.747,0.665,0.582,0.502,0.426,0.356,0.293,0.237,0.189,0.148,0.115,0.087,0.065,0.048,0.002,0.003,0.004,0.007,0.01,0.015,0.022,0.031,0.045,0.062,0.086,0.116,0.155,0.204,0.264,0.337,0.423,0.522,0.634,0.759,0.895,1.038,1.185,1.333,1.475,1.607,1.724,1.821,1.894,1.939,1.954,1.939,1.894,1.821,1.724,1.607,1.475,1.333,1.185,1.038,0.895,0.759,0.634,0.522,0.423,0.337,0.264,0.204,0.155,0.116,0.086,0.003,0.005,0.007,0.011,0.017,0.026,0.037,0.054,0.077,0.108,0.148,0.201,0.268,0.353,0.456,0.581,0.729,0.9,1.095,1.31,1.544,1.791,2.045,2.299,2.545,2.773,2.975,3.143,3.268,3.345,3.371,3.345,3.268,3.143,2.975,2.773,2.545,2.299,2.045,1.791,1.544,1.31,1.095,0.9,0.729,0.581,0.456,0.353,0.268,0.201,0.148,0.005,0.008,0.012,0.019,0.029,0.043,0.063,0.09,0.128,0.179,0.247,0.335,0.448,0.589,0.762,0.97,1.217,1.503,1.827,2.187,2.577,2.989,3.413,3.838,4.248,4.629,4.967,5.246,5.455,5.584,5.628,5.584,5.455,5.246,4.967,4.629,4.248,3.838,3.413,2.989,2.577,2.187,1.827,1.503,1.217,0.97,0.762,0.589,0.448,0.335,0.247,0.008,0.013,0.02,0.031,0.046,0.069,0.101,0.146,0.207,0.29,0.399,0.542,0.723,0.951,1.23,1.567,1.966,2.427,2.951,3.532,4.161,4.827,5.513,6.198,6.861,7.476,8.021,8.472,8.809,9.018,9.089,9.018,8.809,8.472,8.021,7.476,6.861,6.198,5.513,4.827,4.161,3.532,2.951,2.427,1.966,1.567,1.23,0.951,0.723,0.542,0.399,0.013,0.02,0.031,0.048,0.072,0.108,0.158,0.228,0.324,0.453,0.624,0.846,1.13,1.485,1.922,2.449,3.071,3.793,4.611,5.518,6.502,7.542,8.614,9.685,10.72,11.682,12.533,13.237,13.765,14.091,14.202,14.091,13.765,13.237,12.533,11.682,10.72,9.685,8.614,7.542,6.502,5.518,4.611,3.793,3.071,2.449,1.922,1.485,1.13,0.846,0.624,0.019,0.03,0.047,0.072,0.109,0.163,0.238,0.344,0.489,0.685,0.943,1.279,1.708,2.245,2.905,3.702,4.643,5.733,6.97,8.342,9.829,11.402,13.021,14.64,16.205,17.659,18.946,20.011,20.808,21.301,21.468,21.301,20.808,20.011,18.946,17.659,16.205,14.64,13.021,11.402,9.829,8.342,6.97,5.733,4.643,3.702,2.905,2.245,1.708,1.279,0.943,0.028,0.044,0.069,0.106,0.16,0.238,0.349,0.504,0.716,1.001,1.38,1.871,2.498,3.284,4.249,5.414,6.79,8.385,10.193,12.2,14.375,16.675,19.044,21.411,23.7,25.827,27.708,29.266,30.432,31.153,31.398,31.153,30.432,29.266,27.708,25.827,23.7,21.411,19.044,16.675,14.375,12.2,10.193,8.385,6.79,5.414,4.249,3.284,2.498,1.871,1.38,0.039,0.062,0.097,0.149,0.226,0.337,0.494,0.713,1.013,1.417,1.952,2.647,3.535,4.646,6.013,7.66,9.608,11.864,14.423,17.262,20.34,23.595,26.946,30.297,33.535,36.545,39.207,41.41,43.06,44.081,44.427,44.081,43.06,41.41,39.207,36.545,33.535,30.297,26.946,23.595,20.34,17.262,14.423,11.864,9.608,7.66,6.013,4.646,3.535,2.647,1.952,0.054,0.085,0.133,0.204,0.309,0.461,0.676,0.975,1.386,1.94,2.672,3.624,4.839,6.36,8.231,10.486,13.153,16.242,19.745,23.632,27.845,32.3,36.888,41.475,45.908,50.028,53.672,56.689,58.947,60.345,60.819,60.345,58.947,56.689,53.672,50.028,45.908,41.475,36.888,32.3,27.845,23.632,19.745,16.242,13.153,10.486,8.231,6.36,4.839,3.624,2.672,0.071,0.113,0.176,0.271,0.41,0.61,0.895,1.292,1.836,2.569,3.539,4.8,6.409,8.424,10.901,13.889,17.42,21.511,26.151,31.299,36.879,42.78,48.856,54.931,60.803,66.259,71.086,75.081,78.072,79.924,80.551,79.924,78.072,75.081,71.086,66.259,60.803,54.931,48.856,42.78,36.879,31.299,26.151,21.511,17.42,13.889,10.901,8.424,6.409,4.8,3.539,0.091,0.145,0.226,0.347,0.525,0.782,1.147,1.655,2.353,3.292,4.535,6.15,8.212,10.794,13.969,17.797,22.322,27.564,33.509,40.105,47.256,54.817,62.603,70.387,77.911,84.903,91.087,96.208,100.04,102.412,103.216,102.412,100.04,96.208,91.087,84.903,77.911,70.387,62.603,54.817,47.256,40.105,33.509,27.564,22.322,17.797,13.969,10.794,8.212,6.15,4.535,0.113,0.179,0.28,0.43,0.651,0.969,1.421,2.052,2.917,4.081,5.622,7.625,10.18,13.382,17.317,22.063,27.673,34.171,41.542,49.719,58.583,67.958,77.61,87.259,96.587,105.255,112.922,119.269,124.02,126.961,127.957,126.961,124.02,119.269,112.922,105.255,96.587,87.259,77.61,67.958,58.583,49.719,41.542,34.171,27.673,22.063,17.317,13.382,10.18,7.625,5.622,0.136,0.215,0.336,0.516,0.781,1.163,1.705,2.461,3.498,4.895,6.743,9.145,12.21,16.05,20.77,26.462,33.191,40.985,49.825,59.633,70.264,81.508,93.085,104.658,115.846,126.242,135.438,143.051,148.75,152.277,153.471,152.277,148.75,143.051,135.438,126.242,115.846,104.658,93.085,81.508,70.264,59.633,49.825,40.985,33.191,26.462,20.77,16.05,12.21,9.145,6.743,0.157,0.25,0.39,0.599,0.906,1.349,1.978,2.856,4.059,5.68,7.825,10.612,14.169,18.624,24.102,30.706,38.514,47.559,57.817,69.197,81.534,94.582,108.015,121.445,134.427,146.491,157.162,165.996,172.608,176.702,178.087,176.702,172.608,165.996,157.162,146.491,134.427,121.445,108.015,94.582,81.534,69.197,57.817,47.559,38.514,30.706,24.102,18.624,14.169,10.612,7.825,0.177,0.28,0.437,0.672,1.017,1.515,2.221,3.206,4.557,6.377,8.784,11.913,15.906,20.909,27.058,34.473,43.238,53.392,64.908,77.685,91.536,106.183,121.265,136.342,150.917,null,176.439,186.357,193.781,198.376,199.932,198.376,193.781,186.357,176.439,164.46,150.917,136.342,121.265,106.183,91.536,77.685,64.908,53.392,43.238,34.473,27.058,20.909,15.906,11.913,8.784,0.192,0.304,0.475,0.73,1.104,1.645,2.412,3.483,4.95,6.926,9.541,12.94,17.277,22.71,29.389,37.443,46.964,57.992,70.501,84.378,99.422,115.331,131.713,148.088,163.919,178.629,191.641,202.413,210.476,215.467,217.157,215.467,210.476,202.413,191.641,178.629,163.919,148.088,131.713,115.331,99.422,84.378,70.501,57.992,46.964,37.443,29.389,22.71,17.277,12.94,9.541,0.202,0.32,0.499,0.767,1.161,1.729,2.535,3.66,5.202,7.278,10.026,13.598,18.155,23.865,30.883,39.346,49.351,60.94,74.085,88.668,104.476,121.194,138.408,155.617,172.252,187.71,201.383,212.703,221.176,226.421,228.197,226.421,221.176,212.703,201.383,187.71,172.252,155.617,138.408,121.194,104.476,88.668,74.085,60.94,49.351,39.346,30.883,23.865,18.155,13.598,10.026,0.205,0.325,0.507,0.78,1.18,1.758,2.577,3.721,5.288,7.4,10.193,13.824,18.458,24.262,31.398,40.002,50.174,61.956,75.319,90.145,106.217,123.214,140.715,158.21,175.123,190.838,204.739,216.248,224.862,230.195,232.0,230.195,224.862,216.248,204.739,190.838,175.123,158.21,140.715,123.214,106.217,90.145,75.319,61.956,50.174,40.002,31.398,24.262,18.458,13.824,10.193,0.202,0.32,0.499,0.767,1.161,1.729,2.535,3.66,5.202,7.278,10.026,13.598,18.155,23.865,30.883,39.346,49.351,60.94,74.085,88.668,104.476,121.194,138.408,155.617,172.252,187.71,201.383,212.703,221.176,226.421,228.197,226.421,221.176,212.703,201.383,187.71,172.252,155.617,138.408,121.194,104.476,88.668,74.085,60.94,49.351,39.346,30.883,23.865,18.155,13.598,10.026,0.192,0.304,0.475,0.73,1.104,1.645,2.412,3.483,4.95,6.926,9.541,12.94,17.277,22.71,29.389,37.443,46.964,57.992,70.501,84.378,99.422,115.331,131.713,148.088,163.919,178.629,191.641,202.413,210.476,215.467